{
  "$schema": "https://json-schema.org/draft/2020-12/schema",
  "$id": "https://github.com/SoBatista/VulnDockyard/raw/main/src/vulndockyard/data/schemas/lock-v1.schema.json",
  "title": "VulnDockyard immutable lab lock v1",
  "type": "object",
  "additionalProperties": false,
  "required": [
    "schema_version",
    "lab_id",
    "lab_version",
    "upstream_release",
    "upstream_commit",
    "images",
    "template_sha256",
    "source_sha256",
    "build_recipe_revision",
    "sbom_url",
    "provenance_url",
    "signature_url",
    "redistribution_status",
    "redistribution_evidence_url",
    "trust_evidence",
    "verified_at",
    "verified_platforms",
    "verification_evidence"
  ],
  "$defs": {
    "strings": {
      "type": "array",
      "items": {
        "type": "string",
        "minLength": 1
      }
    },
    "httpsStrings": {
      "type": "array",
      "items": {
        "type": "string",
        "format": "uri",
        "pattern": "^https://[^/?#]+"
      }
    },
    "platforms": {
      "type": "array",
      "items": {
        "enum": [
          "linux/amd64",
          "linux/arm64",
          "linux/arm/v7"
        ]
      },
      "uniqueItems": true
    },
    "optionalHttpsUrl": {
      "anyOf": [
        {
          "const": ""
        },
        {
          "type": "string",
          "format": "uri",
          "pattern": "^https://[^/?#]+"
        }
      ]
    },
    "image": {
      "type": "object",
      "additionalProperties": false,
      "required": [
        "name",
        "digest",
        "architectures",
        "role"
      ],
      "properties": {
        "name": {
          "type": "string",
          "minLength": 3,
          "maxLength": 255,
          "pattern": "^(?:(?:[a-z0-9](?:[a-z0-9-]*[a-z0-9])?\\.)+[a-z0-9](?:[a-z0-9-]*[a-z0-9])?|localhost)(?::[1-9][0-9]{0,4})?/[a-z0-9]+(?:[._-][a-z0-9]+)*(?:/[a-z0-9]+(?:[._-][a-z0-9]+)*)*$"
        },
        "digest": {
          "type": "string",
          "pattern": "^sha256:[0-9a-f]{64}$"
        },
        "architectures": {
          "$ref": "#/$defs/platforms"
        },
        "role": {
          "type": "string",
          "minLength": 1
        }
      }
    }
  },
  "properties": {
    "schema_version": {
      "const": 1
    },
    "lab_id": {
      "type": "string",
      "pattern": "^[a-z][a-z0-9-]{1,62}$"
    },
    "lab_version": {
      "type": "string",
      "minLength": 1
    },
    "upstream_release": {
      "type": "string",
      "minLength": 1
    },
    "upstream_commit": {
      "type": "string",
      "pattern": "^(|[0-9a-f]{40})$"
    },
    "images": {
      "type": "array",
      "items": {
        "$ref": "#/$defs/image"
      }
    },
    "template_sha256": {
      "type": "string",
      "pattern": "^(|sha256:[0-9a-f]{64})$"
    },
    "source_sha256": {
      "type": "string",
      "pattern": "^(|sha256:[0-9a-f]{64})$"
    },
    "build_recipe_revision": {
      "type": "string"
    },
    "sbom_url": {
      "$ref": "#/$defs/optionalHttpsUrl"
    },
    "provenance_url": {
      "$ref": "#/$defs/optionalHttpsUrl"
    },
    "signature_url": {
      "$ref": "#/$defs/optionalHttpsUrl"
    },
    "redistribution_status": {
      "enum": [
        "not-applicable",
        "unresolved",
        "permitted",
        "prohibited"
      ]
    },
    "redistribution_evidence_url": {
      "$ref": "#/$defs/optionalHttpsUrl"
    },
    "trust_evidence": {
      "allOf": [
        {
          "$ref": "#/$defs/httpsStrings"
        }
      ],
      "minItems": 1
    },
    "verified_at": {
      "type": "string",
      "format": "date-time",
      "pattern": "^[0-9]{4}-[0-9]{2}-[0-9]{2}T[0-9]{2}:[0-9]{2}:[0-9]{2}Z$"
    },
    "verified_platforms": {
      "$ref": "#/$defs/platforms"
    },
    "verification_evidence": {
      "$ref": "#/$defs/strings"
    }
  },
  "allOf": [
    {
      "if": {
        "properties": {
          "redistribution_status": {
            "enum": [
              "permitted",
              "prohibited"
            ]
          }
        }
      },
      "then": {
        "properties": {
          "redistribution_evidence_url": {
            "type": "string",
            "format": "uri",
            "pattern": "^https://[^/?#]+"
          }
        }
      }
    }
  ]
}
