{
  "schema_version": 1,
  "lab_id": "nodegoat",
  "lab_version": "1.4",
  "upstream_release": "v1.4",
  "upstream_commit": "9e35cae25f5c6226c30c7d9b03987005affb2888",
  "images": [],
  "template_sha256": "",
  "source_sha256": "",
  "build_recipe_revision": "",
  "sbom_url": "",
  "provenance_url": "",
  "signature_url": "",
  "redistribution_status": "unresolved",
  "redistribution_evidence_url": "",
  "trust_evidence": [
    "https://github.com/OWASP/NodeGoat/blob/v1.4/docker-compose.yml",
    "https://github.com/OWASP/NodeGoat/blob/v1.4/Dockerfile"
  ],
  "verified_at": "2026-09-06T00:00:00Z",
  "verified_platforms": [],
  "verification_evidence": []
}
