{
  "schema_version": 1,
  "lab_id": "vampi",
  "lab_version": "f16052d",
  "upstream_release": "master",
  "upstream_commit": "f16052dce83f05847133ec98f01c5193a41de7d8",
  "images": [],
  "template_sha256": "",
  "source_sha256": "",
  "build_recipe_revision": "",
  "sbom_url": "",
  "provenance_url": "",
  "signature_url": "",
  "redistribution_status": "not-applicable",
  "redistribution_evidence_url": "",
  "trust_evidence": [
    "https://github.com/erev0s/VAmPI/blob/f16052dce83f05847133ec98f01c5193a41de7d8/.github/workflows/docker-image.yml"
  ],
  "verified_at": "2026-09-06T00:00:00Z",
  "verified_platforms": [],
  "verification_evidence": []
}
