{
  "schema_version": 1,
  "lab_id": "crapi",
  "lab_version": "1.1.6",
  "upstream_release": "v1.1.6",
  "upstream_commit": "700f03d12a392d9e408260b4beae72ed02a4a1a4",
  "images": [],
  "template_sha256": "",
  "source_sha256": "",
  "build_recipe_revision": "",
  "sbom_url": "",
  "provenance_url": "",
  "signature_url": "",
  "redistribution_status": "not-applicable",
  "redistribution_evidence_url": "",
  "trust_evidence": [
    "https://github.com/OWASP/crAPI/blob/v1.1.6/.github/workflows/publish.yml",
    "https://github.com/OWASP/crAPI/blob/v1.1.6/deploy/docker/docker-compose.yml"
  ],
  "verified_at": "2026-09-06T00:00:00Z",
  "verified_platforms": [],
  "verification_evidence": []
}
