{
  "schema_version": 1,
  "lab_id": "juice-shop",
  "lab_version": "20.2.0",
  "upstream_release": "v20.2.0",
  "upstream_commit": "5658473cf8814459bf89000ce373b20ed0b4eb37",
  "images": [
    {
      "name": "docker.io/bkimminich/juice-shop",
      "digest": "sha256:8739101ade29358abb5469ee66ae78e582c97ed0a5543a4ad102e5fa5193526b",
      "architectures": [
        "linux/amd64",
        "linux/arm64"
      ],
      "role": "application"
    },
    {
      "name": "docker.io/library/caddy",
      "digest": "sha256:4c6e91c6ed0e2fa03efd5b44747b625fec79bc9cd06ac5235a779726618e530d",
      "architectures": [
        "linux/amd64",
        "linux/arm64"
      ],
      "role": "gateway"
    }
  ],
  "template_sha256": "sha256:a6387e0439c8d16db26fa473e53b46e22280560b75f32e9d4ca018fc475ddd2f",
  "source_sha256": "",
  "build_recipe_revision": "",
  "sbom_url": "",
  "provenance_url": "",
  "signature_url": "",
  "redistribution_status": "not-applicable",
  "redistribution_evidence_url": "",
  "trust_evidence": [
    "https://github.com/juice-shop/juice-shop/blob/v20.2.0/.github/workflows/release.yml",
    "https://hub.docker.com/v2/repositories/bkimminich/juice-shop/tags/v20.2.0",
    "https://github.com/docker-library/official-images/blob/master/library/caddy",
    "https://hub.docker.com/_/caddy"
  ],
  "verified_at": "2026-09-06T15:36:29Z",
  "verified_platforms": [
    "linux/amd64"
  ],
  "verification_evidence": [
    "github-actions-run-34042789523:head-110e12693be25768c42013461939bb8f6968b7cb:ubuntu-24.04:linux-amd64:docker-engine-minimum-28-enforced:identity-and-lifecycle-passed:2026-09-06"
  ]
}
