{
  "schema_version": 1,
  "lab_id": "bwapp",
  "lab_version": "2.2",
  "upstream_release": "2.2",
  "upstream_commit": "",
  "images": [],
  "template_sha256": "",
  "source_sha256": "",
  "build_recipe_revision": "",
  "sbom_url": "",
  "provenance_url": "",
  "signature_url": "",
  "redistribution_status": "unresolved",
  "redistribution_evidence_url": "",
  "trust_evidence": [
    "https://sourceforge.net/p/bwapp/code/ci/master/tree/bWAPP/credits.php?format=raw",
    "https://sourceforge.net/rest/p/bwapp"
  ],
  "verified_at": "2026-09-06T00:00:00Z",
  "verified_platforms": [],
  "verification_evidence": []
}
